{
  "schema_version": "1.0",
  "run_id": "replace-me-v001",
  "profile": "full_body_standard",
  "side_convention": "character_perspective",
  "canvas": {
    "width": 4096,
    "height": 8192,
    "origin": "top_left"
  },
  "parts": [
    {
      "id": "guide_reference",
      "display_name": "guide_reference",
      "group": "00_guides",
      "category": "guide",
      "side": "none",
      "imported": false,
      "required_if": "never",
      "needs_hidden_reconstruction": false,
      "motion_role": "none",
      "clipped_to": null,
      "z_index": null,
      "occludes": [],
      "occluded_by": [],
      "motion_envelope": {
        "translate_x_px": 0,
        "translate_y_px": 0,
        "rotate_deg": 0
      },
      "overlap_px": 64,
      "status": "planned"
    },
    {
      "id": "hair_back_base",
      "display_name": "hair_back_base",
      "group": "10_hair_back",
      "category": "hair",
      "side": "none",
      "imported": true,
      "required_if": "always",
      "needs_hidden_reconstruction": true,
      "motion_role": "physics",
      "clipped_to": null,
      "z_index": null,
      "occludes": [],
      "occluded_by": [],
      "motion_envelope": {
        "translate_x_px": 0,
        "translate_y_px": 0,
        "rotate_deg": 0
      },
      "overlap_px": 64,
      "status": "planned"
    },
    {
      "id": "hair_back_outer_l",
      "display_name": "hair_back_outer_l",
      "group": "10_hair_back",
      "category": "hair",
      "side": "l",
      "imported": true,
      "required_if": "long_or_layered_hair",
      "needs_hidden_reconstruction": true,
      "motion_role": "physics",
      "clipped_to": null,
      "z_index": null,
      "occludes": [],
      "occluded_by": [],
      "motion_envelope": {
        "translate_x_px": 0,
        "translate_y_px": 0,
        "rotate_deg": 0
      },
      "overlap_px": 64,
      "status": "planned"
    },
    {
      "id": "hair_back_inner_l",
      "display_name": "hair_back_inner_l",
      "group": "10_hair_back",
      "category": "hair",
      "side": "l",
      "imported": true,
      "required_if": "long_or_layered_hair",
      "needs_hidden_reconstruction": true,
      "motion_role": "physics",
      "clipped_to": null,
      "z_index": null,
      "occludes": [],
      "occluded_by": [],
      "motion_envelope": {
        "translate_x_px": 0,
        "translate_y_px": 0,
        "rotate_deg": 0
      },
      "overlap_px": 64,
      "status": "planned"
    },
    {
      "id": "hair_back_outer_r",
      "display_name": "hair_back_outer_r",
      "group": "10_hair_back",
      "category": "hair",
      "side": "r",
      "imported": true,
      "required_if": "long_or_layered_hair",
      "needs_hidden_reconstruction": true,
      "motion_role": "physics",
      "clipped_to": null,
      "z_index": null,
      "occludes": [],
      "occluded_by": [],
      "motion_envelope": {
        "translate_x_px": 0,
        "translate_y_px": 0,
        "rotate_deg": 0
      },
      "overlap_px": 64,
      "status": "planned"
    },
    {
      "id": "hair_back_inner_r",
      "display_name": "hair_back_inner_r",
      "group": "10_hair_back",
      "category": "hair",
      "side": "r",
      "imported": true,
      "required_if": "long_or_layered_hair",
      "needs_hidden_reconstruction": true,
      "motion_role": "physics",
      "clipped_to": null,
      "z_index": null,
      "occludes": [],
      "occluded_by": [],
      "motion_envelope": {
        "translate_x_px": 0,
        "translate_y_px": 0,
        "rotate_deg": 0
      },
      "overlap_px": 64,
      "status": "planned"
    },
    {
      "id": "hair_back_strand_l_01",
      "display_name": "hair_back_strand_l_01",
      "group": "10_hair_back",
      "category": "hair",
      "side": "l",
      "imported": true,
      "required_if": "independent_back_strand",
      "needs_hidden_reconstruction": true,
      "motion_role": "physics",
      "clipped_to": null,
      "z_index": null,
      "occludes": [],
      "occluded_by": [],
      "motion_envelope": {
        "translate_x_px": 0,
        "translate_y_px": 0,
        "rotate_deg": 0
      },
      "overlap_px": 64,
      "status": "planned"
    },
    {
      "id": "hair_back_strand_r_01",
      "display_name": "hair_back_strand_r_01",
      "group": "10_hair_back",
      "category": "hair",
      "side": "r",
      "imported": true,
      "required_if": "independent_back_strand",
      "needs_hidden_reconstruction": true,
      "motion_role": "physics",
      "clipped_to": null,
      "z_index": null,
      "occludes": [],
      "occluded_by": [],
      "motion_envelope": {
        "translate_x_px": 0,
        "translate_y_px": 0,
        "rotate_deg": 0
      },
      "overlap_px": 64,
      "status": "planned"
    },
    {
      "id": "hair_back_strand_l_02",
      "display_name": "hair_back_strand_l_02",
      "group": "10_hair_back",
      "category": "hair",
      "side": "l",
      "imported": true,
      "required_if": "independent_back_strand",
      "needs_hidden_reconstruction": true,
      "motion_role": "physics",
      "clipped_to": null,
      "z_index": null,
      "occludes": [],
      "occluded_by": [],
      "motion_envelope": {
        "translate_x_px": 0,
        "translate_y_px": 0,
        "rotate_deg": 0
      },
      "overlap_px": 64,
      "status": "planned"
    },
    {
      "id": "hair_back_strand_r_02",
      "display_name": "hair_back_strand_r_02",
      "group": "10_hair_back",
      "category": "hair",
      "side": "r",
      "imported": true,
      "required_if": "independent_back_strand",
      "needs_hidden_reconstruction": true,
      "motion_role": "physics",
      "clipped_to": null,
      "z_index": null,
      "occludes": [],
      "occluded_by": [],
      "motion_envelope": {
        "translate_x_px": 0,
        "translate_y_px": 0,
        "rotate_deg": 0
      },
      "overlap_px": 64,
      "status": "planned"
    },
    {
      "id": "hair_back_strand_l_03",
      "display_name": "hair_back_strand_l_03",
      "group": "10_hair_back",
      "category": "hair",
      "side": "l",
      "imported": true,
      "required_if": "independent_back_strand",
      "needs_hidden_reconstruction": true,
      "motion_role": "physics",
      "clipped_to": null,
      "z_index": null,
      "occludes": [],
      "occluded_by": [],
      "motion_envelope": {
        "translate_x_px": 0,
        "translate_y_px": 0,
        "rotate_deg": 0
      },
      "overlap_px": 64,
      "status": "planned"
    },
    {
      "id": "hair_back_strand_r_03",
      "display_name": "hair_back_strand_r_03",
      "group": "10_hair_back",
      "category": "hair",
      "side": "r",
      "imported": true,
      "required_if": "independent_back_strand",
      "needs_hidden_reconstruction": true,
      "motion_role": "physics",
      "clipped_to": null,
      "z_index": null,
      "occludes": [],
      "occluded_by": [],
      "motion_envelope": {
        "translate_x_px": 0,
        "translate_y_px": 0,
        "rotate_deg": 0
      },
      "overlap_px": 64,
      "status": "planned"
    },
    {
      "id": "torso_base",
      "display_name": "torso_base",
      "group": "20_body",
      "category": "body",
      "side": "none",
      "imported": true,
      "required_if": "always",
      "needs_hidden_reconstruction": true,
      "motion_role": "rigid_or_deform",
      "clipped_to": null,
      "z_index": null,
      "occludes": [],
      "occluded_by": [],
      "motion_envelope": {
        "translate_x_px": 0,
        "translate_y_px": 0,
        "rotate_deg": 0
      },
      "overlap_px": 64,
      "status": "planned"
    },
    {
      "id": "neck",
      "display_name": "neck",
      "group": "20_body",
      "category": "body",
      "side": "center",
      "imported": true,
      "required_if": "always",
      "needs_hidden_reconstruction": true,
      "motion_role": "rigid_or_deform",
      "clipped_to": null,
      "z_index": null,
      "occludes": [],
      "occluded_by": [],
      "motion_envelope": {
        "translate_x_px": 0,
        "translate_y_px": 0,
        "rotate_deg": 0
      },
      "overlap_px": 64,
      "status": "planned"
    },
    {
      "id": "head_base",
      "display_name": "head_base",
      "group": "20_body",
      "category": "face",
      "side": "center",
      "imported": true,
      "required_if": "always",
      "needs_hidden_reconstruction": true,
      "motion_role": "rigid_or_deform",
      "clipped_to": null,
      "z_index": null,
      "occludes": [],
      "occluded_by": [],
      "motion_envelope": {
        "translate_x_px": 0,
        "translate_y_px": 0,
        "rotate_deg": 0
      },
      "overlap_px": 64,
      "status": "planned"
    },
    {
      "id": "ear_l",
      "display_name": "ear_l",
      "group": "20_body",
      "category": "face",
      "side": "l",
      "imported": true,
      "required_if": "always",
      "needs_hidden_reconstruction": true,
      "motion_role": "rigid_or_deform",
      "clipped_to": null,
      "z_index": null,
      "occludes": [],
      "occluded_by": [],
      "motion_envelope": {
        "translate_x_px": 0,
        "translate_y_px": 0,
        "rotate_deg": 0
      },
      "overlap_px": 64,
      "status": "planned"
    },
    {
      "id": "shoulder_l",
      "display_name": "shoulder_l",
      "group": "20_body",
      "category": "body",
      "side": "l",
      "imported": true,
      "required_if": "arm_moves_independently",
      "needs_hidden_reconstruction": true,
      "motion_role": "rigid_or_deform",
      "clipped_to": null,
      "z_index": null,
      "occludes": [],
      "occluded_by": [],
      "motion_envelope": {
        "translate_x_px": 0,
        "translate_y_px": 0,
        "rotate_deg": 0
      },
      "overlap_px": 64,
      "status": "planned"
    },
    {
      "id": "upper_arm_l",
      "display_name": "upper_arm_l",
      "group": "20_body",